{
  "schemaVersion": "health.v1",
  "status": "down",
  "service": "converter",
  "version": "a1b2c3d",
  "environment": "production",
  "timestamp": "2026-07-26T00:00:00Z",
  "uptimeMs": 12345,
  "checks": [
    {
      "name": "converter",
      "status": "down",
      "message": "runtime unavailable"
    }
  ]
}
