{
  "schemaVersion": "health.v1",
  "status": "limited",
  "service": "phoenix",
  "version": "a1b2c3d",
  "environment": "production",
  "timestamp": "2026-07-26T00:00:00Z",
  "uptimeMs": 12345,
  "checks": [
    {
      "name": "search",
      "status": "limited",
      "message": "provider timeout"
    }
  ]
}
